commit	score	fp32_map	q_map	lat_ms	size_mb	mem_mb	qnn_ok	cpu_fb	status	description
5265863	0.0869	0.1735	0.0869	0.97	6.84	10.2	true	0	keep	baseline: SSDLite320-MobileNetV3-Large + pseudo-label distill 2000 imgs/1 epoch + INT8 PTQ
exp1	0.1045	0.1776	0.1045	1.66	6.97	8.8	true	0	keep	w8a16 quant: hold activations 16-bit to recover regression head (+20%)
exp2	0.1179	0.1727	0.1179	1.67	6.97	9.7	true	0	keep	bump training: 2000->5000 imgs / 1->2 epochs — quant_map +13% via more stable activations
exp3	0.1370	0.1740	0.1370	1.66	6.97	9.4	true	0	keep	real-image PTQ calibration (64 val imgs) closes another 16% of quant gap
exp4	0.1354	0.1661	0.1354	1.67	6.97	10.0	true	0	discard	lower teacher pseudo-label threshold 0.5->0.3: too much teacher noise hurts fp32
exp5	0.1260	0.1710	0.1260	1.66	6.97	10.4	true	0	discard	mix GT + teacher pseudo-labels: duplicate signal hurts quant
40994f0	0.1924	0.2380	0.1924	1.66	6.97	9.6	true	0	keep	PROBE win: NUM_EPOCHS=0 — pretrained ssdlite > all our fine-tuned versions
b8e6380	0.1931	0.2380	0.1931	1.66	6.97	9.9	true	0	keep	calibration 64 -> 256 imgs (marginal +0.0007, calib effect saturated)
776767d	0.1772	0.2326	0.1772	1.66	6.97	9.4	true	0	discard	gentle fine-tune LR=1e-5 1 epoch teacher pseudo: still hurts fp32 -0.005 and quant -0.016 (pseudo signal toxic at any LR)
7178ee7	0.0001	0.2380	0.0001	1.66	3.50	9.6	true	0	discard	w4a16 PTQ — 4-bit weights collapse without QAT (would need training-aware quant)
9b3c9d3	0.1774	0.2320	0.1774	1.67	6.97	10.5	true	0	discard	GT-only LR=1e-5 1 epoch — pretrained (trained on full train2017) beats any fine-tune we can do on 4500 val
eee4672	0.1795	0.2336	0.1795	1.66	6.97	10.2	true	0	discard	Phase A: SSD-VGG teacher (same SSD framework as student). Loss converged faster (1.5-3 vs 3-5 with RetinaNet) but fp32 0.234 / quant 0.180 still below pretrained baseline — same-framework hypothesis FALSIFIED, problem is data scale not anchor alignment
